FieldName,iOrder,Topic,EnglishName,EnglishNameShort,cpOrder,
mgmt8,8,Management Practices,Score on extent to which non-managers are promoted based on performance,Score on extent to which non-managers are promoted based on performance,,
mgmt9,9,Management Practices,Score on extent to which under-performing non-managers are reassigned or dismissed,Score on extent to which under-performing non-managers are reassigned or dismissed,,
t7,1,Innovation and Technology,Percent of firms that introduced a new product/service over last 3 years,% firms introducing new product/service,,
t8,2,Innovation and Technology,Percent of firms whose new product/service is also new to the main market,% firms whose new product/service also new to the market,,
t9,3,Innovation and Technology,Percent of firms that introduced a process innovation over last 3 years,% firms introducing a process innovation,,
t10,4,Innovation and Technology,Percent of firms that spend on R&D in the last fiscal years,% firms that spend on R&D,,
bready_t11,5,Innovation and Technology,"[B-READY] Percent of firms that introduced a new product/service and process over last 3 years, and spent on R&D over last fiscal year (excluding small firms)","% firms that introduced a new product/service and process, and spent on R&D",,
bready_t1,6,Innovation and Technology,[B-READY] Percent of firms with an internationally-recognized quality certification,% firms with an international quality certification,,
t4,7,Innovation and Technology,Percent of firms using technology licensed from foreign companies*,% firms using technology licensed from foreign companies*,,
t5,8,Innovation and Technology,Percent of firms having their own web site,% firms having their own Web site,,
perf1,1,Firm Profile,Real annual sales growth (%),Real annual sales growth (%),,
perf2,2,Firm Profile,Annual employment growth (%),Annual employment growth (%),,
perf3,3,Firm Profile,Real annual labor productivity growth (%),Real annual labor productivity growth (%),,
perf4,4,Firm Profile,Percent of firms buying fixed assets,% firms buying fixed assets,,
t3,5,Firm Profile,Capacity utilization (%)*,Capacity utilization (%)*,,
car1,6,Firm Profile,Age of the establishment (years),Age of the establishment (years),,
car7,7,Firm Profile,Percent of firms with at least 10% of foreign ownership,% firms with at least 10% foreign ownershop,,
car8,8,Firm Profile,Percent of firms with at least 10% of government/state ownership,% firms with at least 10% government/state ownershop,,
car2,9,Firm Profile,Proportion of private domestic ownership in a firm (%),% private domestic ownership in a firm,,
car3,,Firm Profile,Proportion of private foreign ownership in a firm (%),% private foreign ownership in a firm,,
car4,,Firm Profile,Proportion of government/state ownership in a firm (%),% govt/state ownership in a firm,,
car5,,Firm Profile,Proportion of other ownership in a firm (%),,,
car6,,Firm Profile,Proportion of a firm held by the largest owner(s) (%),% a firm held by the largest owner(s) (%),,
lform3,10,Firm Profile,Percent of firms with legal status of Sole Proprietorship,% firms with legal status of Sole Proprietorship,,
lform,,Firm Profile,Legal status,,,
lform_max,,Firm Profile,Most common legal form,,,
lform1,,Firm Profile,Percent of firms with legal status of publicly listed company,% firms with legal status of publicly listed company,,
lform2,,Firm Profile,Percent of firms with legal status of privately held Limited Liability Company ,% firms with legal status of privately held LLC ,,
lform4,,Firm Profile,Percent of firms with legal status of Partnership,% firms with legal status of Partnership,,
lform5,,Firm Profile,Percent of firms with legal status of Limited Partnership,% firms with legal status of Limited Partnership,,
lform6,,Firm Profile,Legal status - Other,,,
obst1,1,Biggest Obstacle,Percent of firms choosing access to finance as their biggest obstacle,% firms choosing access to finance as the biggest obstacle,,
obst2,2,Biggest Obstacle,Percent of firms choosing access to land as their biggest obstacle,% firms choosing access to land as the biggest obstacle,,
obst3,3,Biggest Obstacle,Percent of firms choosing business licensing and permits as their biggest obstacle,% firms choosing business licensing as the biggest obstacle,,
obst4,4,Biggest Obstacle,Percent of firms choosing corruption as their biggest obstacle,% firms choosing corruption as the biggest obstacle,,
obst5,5,Biggest Obstacle,Percent of firms choosing courts as their biggest obstacle,% firms choosing courts as the biggest obstacle,,
obst6,6,Biggest Obstacle,"Percent of firms choosing crime, theft and disorder as their biggest obstacle",% firms choosing crime and disorder as the biggest obstacle,,
obst7,7,Biggest Obstacle,Percent of firms choosing customs and trade regulations as their biggest obstacle,% firms choosing trade regulations as the biggest obstacle,,
obst8,8,Biggest Obstacle,Percent of firms choosing electricity as their biggest obstacle,% firms choosing electricity as the biggest obstacle,,
obst9,9,Biggest Obstacle,Percent of firms choosing inadequately educated workforce as their biggest obstacle,% firms choosing poorly educated workers as the biggest obstacle,,
obst10,10,Biggest Obstacle,Percent of firms choosing labor regulations as their biggest obstacle,% firms choosing labor regulations as the biggest obstacle,,
obst11,11,Biggest Obstacle,Percent of firms choosing political instability as their biggest obstacle,% firms choosing political instability as the biggest obstacle,,
obst12,12,Biggest Obstacle,Percent of firms choosing practices of the informal sector as their biggest obstacle,% firms choosing the informal sector as the biggest obstacle,,
obst13,13,Biggest Obstacle,Percent of firms choosing tax administration as their biggest obstacle,% firms choosing tax administration as the biggest obstacle,,
obst14,14,Biggest Obstacle,Percent of firms choosing tax rates as their biggest obstacle,% firms choosing tax rates as the biggest obstacle,,
obst15,15,Biggest Obstacle,Percent of firms choosing transportation as their biggest obstacle,% firms choosing transportation as the biggest obstacle,,
crime1,,Crime,Percent of firms paying for security,% firms paying for security,,
crime10,,Crime,Percent of firms experiencing losses due to theft and vandalism,% firms experiencing losses due to theft and vandalism,,
crime3,,Crime,Losses due to theft and vandalism against the firm (% of annual sales),Losses due to theft (% of annual sales),,
crime3_c,,Crime,"If there were losses, average losses due to theft and vandalism (% of annual sales)","If there were losses, average losses due to theft (%)",,
crime2,,Crime,Security costs (% of annual sales),Security costs (% of annual sales),,
crime2_c,,Crime,"If the establishment pays for security, average security costs (% of annual sales)","If the establishment pays for security, avg security costs (%)",,
crime5,,Crime,Products shipped to supply domestic markets that were lost due to theft (% of product value)*,Products domestically shipped and stolen (% of product value)*,,
crime8,,Crime,"Percent of firms identifying crime, theft and disorder as a major or very severe constraint              ",% firms identifying crime and disorder as a major+ constraint              ,,
